user_input,response,reference,retrieved_contexts
Is anti-L1CAM radioimmunotherapy more effective with the radiolanthanide terbium-161 compared to lutetium-177 in an ovarian cancer model?,response,Our study is the first to show that anti-L1CAM (161)Tb RIT is more effective compared to (177)Lu RIT in ovarian cancer xenografts. These results suggest that (161)Tb is a promising candidate for future clinical applications in combination with internalising antibodies.,"['The L1 cell adhesion molecule (L1CAM) is considered a valuable target for therapeutic intervention in different types of cancer. Recent studies have shown that anti-L1CAM radioimmunotherapy (RIT) with (67)Cu- and (177)Lu-labelled internalising monoclonal antibody (mAb) chCE7 was effective in the treatment of human ovarian cancer xenografts. In this study, we directly compared the therapeutic efficacy of anti-L1CAM RIT against human ovarian cancer under equitoxic conditions with the radiolanthanide (177)Lu and the potential alternative (161)Tb in an ovarian cancer therapy model. Tb was produced by neutron bombardment of enriched (160)Gd targets. (161)Tb and (177)Lu were used for radiolabelling of DOTA-conjugated antibodies. The in vivo behaviour of the radioimmunoconjugates (RICs) was assessed in IGROV1 tumour-bearing nude mice using biodistribution experiments and SPECT/CT imaging. After ascertaining the maximal tolerated doses (MTD) the therapeutic impact of 50 % MTD of (177)Lu- and (161)Tb-DOTA-chCE7 was evaluated in groups of ten mice by monitoring the tumour size of subcutaneous IGROV1 tumours. The average number of DOTA ligands per antibody was 2.5 and maximum specific activities of 600 MBq/mg were achieved under identical radiolabelling conditions. RICs were stable in human plasma for at least 48 h. (177)Lu- and (161)Tb-DOTA-chCE7 showed high tumour uptake (37.8-39.0 %IA/g, 144 h p.i.) with low levels in off-target organs. SPECT/CT images confirmed the biodistribution data. (161)Tb-labelled chCE7 revealed a higher radiotoxicity in nude mice (MTD: 10 MBq) than the (177)Lu-labelled counterpart (MTD: 12 MBq). In a comparative therapy study with equitoxic doses, tumour growth inhibition was better by 82.6 % for the (161)Tb-DOTA-chCE7 than the (177)Lu-DOTA-chCE7 RIT.']"
Does nEDD9 regulate actin dynamics through cortactin deacetylation in an AURKA/HDAC6-dependent manner?,response,This study provides a mechanistic platform for therapeutic interventions based on AURKA and HDAC6 inhibition for patients with metastatic breast cancer to prevent and/or eradicate metastases.,"['The prometastatic protein NEDD9 (neural precursor cell expressed, developmentally downregulated 9) is highly expressed in many cancers and is required for mesenchymal individual cell migration and progression to the invasive stage. Nevertheless, the molecular mechanisms of NEDD9-driven migration and the downstream targets effecting metastasis are not well defined. In the current study, knockdown of NEDD9 in highly metastatic tumor cells drastically reduces their migratory capacity due to disruption of actin dynamics at the leading edge. Specifically, NEDD9 deficiency leads to a decrease in the persistence and stability of lamellipodial protrusions similar to knockdown of cortactin (CTTN). Mechanistically, it was shown that NEDD9 binds to and regulates acetylation of CTTN in an Aurora A kinase (AURKA)/HDAC6-dependent manner. The knockdown of NEDD9 or AURKA results in an increase in the amount of acetylated CTTN and a decrease in the binding of CTTN to F-actin. Overexpression of the deacetylation mimicking (9KR) mutant of CTTN is sufficient to restore actin dynamics at the leading edge and migration proficiency of the tumor cells. Inhibition of AURKA and HDAC6 activity by alisertib and Tubastatin A in xenograft models of breast cancer leads to a decrease in the number of pulmonary metastases. Collectively, these findings identify CTTN as the key downstream component of NEDD9-driven migration and metastatic phenotypes.']"
Does sirolimus allow early cyclosporine withdrawal in renal transplantation resulting in improved renal function and lower blood pressure?,response,"Sirolimus, CsA, and steroids for 3 months posttransplant, followed by elimination of CsA, is a safe and effective alternative to continuous therapy with sirolimus, CsA, and steroids that can result in better renal function and lower blood pressure.","['This study evaluated whether cyclosporine (CsA) could be eliminated from a sirolimus (Rapamune, rapamycin, SRL)-CsA-steroid (ST) regimen at 3 months. This was an open-label study conducted in Europe, Australia, and Canada. Upon enrollment, 525 primary (90%) or secondary (10%) renal allograft recipients with cadaveric (89%) or living (11%) donors received 2 mg of sirolimus (troughs>5 ng/ml), CsA, and steroids. At 3 months+/-2 weeks, eligible patients were randomized (1:1) to remain on SRL-CsA-ST or to have CsA withdrawn and therapy continued with SRL (troughs 20-30 ng/ml)-ST. At 12 months, overall graft and patient survival were 89.1% and 94.9%, respectively. In the 430 (82%) randomized patients, there was no difference in graft survival (95.8% vs. 97.2%, SRL-CsA-ST vs. SRL-ST) or patient survival (97.2% vs. 98.1%, respectively). The incidence of biopsy-confirmed primary acute rejection was 13.1% during the prerandomization period. After randomization, the acute rejection rates were 4.2% and 9.8% for SRL-CsA-ST and SRL-ST, respectively (P=0.035). Renal function (calculated glomerular filtration rate, 57 vs. 63 ml/min, P<0.001) and blood pressure significantly improved when CsA was withdrawn. Hypertension, CsA nephrotoxicity, hyperuricemia, and Herpes zoster occurred statistically more frequently in patients remaining on CsA, whereas thrombocytopenia, abnormal liver function tests, and hypokalemia were reported more often for SRL-ST therapy.']"
Is fDG-PET assessment of rectal cancer response to neoadjuvant chemoradiotherapy associated with long-term prognosis : a prospective evaluation?,response,"Assessment of rectal cancer response to neoadjuvant chemoradiotherapy by FDG-PET provides no prognostic information. Therefore, serial FDG-PET before and after neoadjuvant chemoradiotherapy should not be performed for this purpose.","['At present there is no defined role for routine FDG-PET in the preoperative evaluation of nonmetastatic rectal cancer. The primary objective of this study was to evaluate the ability of FDG-PET to predict long-term prognosis based on the response to neoadjuvant chemoradiotherapy in patients with locally advanced rectal cancer. This was a prospective study. This study was performed at an academic, tertiary care, comprehensive cancer center. One hundred twenty-seven patients with locally advanced rectal cancer were enrolled between September 1999 and December 2005. All patients underwent FDG-PET scans before and after neoadjuvant chemoradiotherapy. FDG-PET parameters were evaluated by at least 2 study board-certified nuclear medicine physicians, and included mean standard uptake value, maximum standard uptake value, total lesion glycolysis, and visual response score. The main outcome measures were time to recurrence and disease-specific survival. Of 127 patients, 82 (65%) were men, the median age was 60 years (range, 27-82), 110 patients had stage II/III disease, and 17 patients had stage IV disease. Median follow-up among survivors was 77 months (range, 1-115 months). Nine patients had unresectable metastatic disease and were excluded from the time-to-recurrence analysis. At 5 years, 74% (95% CI = 66%-81%) of patients had not had recurrences (locally and/or distantly). The 5-year disease-specific survival was 89% (95% CI = 81%-93%). On univariate analysis, visual response score and time to recurrence came closest to having an association (HR = 0.83, 95% CI = 0.68-1.01, p = 0.06). On multivariate analysis, the visual response score was not significant (p = 0.85). No FDG-PET parameter was associated with disease-specific survival.']"
Is surgical airway necessary for airway management in deep neck infections and Ludwig angina?,response,Treatment of Ludwig angina and deep neck abscesses requires good clinical judgment. Patients with deep neck infections and symptoms of airway compromise may be safely managed with advanced airway control techniques.,"['Deep neck infections are potentially life-threatening conditions because of airway compromise. Management requires early recognition, antibiotics, surgical drainage, and effective airway control. The Surgical Education and Self-Assessment Program 12 states that awake tracheostomy is the treatment of choice for these patients. With advanced airway control techniques such as retrograde intubation, GlideScope, and fiberoptic intubation, surgical airway is not required. A retrospective analysis of all deep neck abscesses treated from December 1999 to July 2006 was performed. All patients who underwent urgent or emergent surgery for Ludwig angina and submental, submandibular, sublingual, and parapharyngeal abscesses (Current Procedural Terminology codes 41015, 41016, 41017, 42320, and 42725) were included in our review. Charts were studied for age, presence of true Ludwig angina, presence of airway compromise, airway management, morbidity/mortality, and the requirement for surgical airway. Of 29 patients, 6 (20%) had symptoms consistent with true Ludwig angina. Nineteen (65.5%) had evidence of airway compromise. Eight (42%) of these 19 patients required advanced airway control techniques. No patient required a surgical airway, and no mortality resulted from airway compromise. Advance airway control techniques were required more often in patients with airway compromise (P<.05).']"
Does marek 's disease virus infection induce widespread differential chromatin marks in inbred chicken lines?,response,Our results confirm the presence of widespread epigenetic differences induced by MD in chicken lines with different levels of genetic resistance. A majority of observed epigenetic changes were indicative of increased levels of viral infection in the susceptible line symptomatic of lowered immunocompetence in these birds caused by early cytolytic infection. The GAL system that has known anti-proliferative effects in other cancers is also revealed to be potentially involved in MD progression. Our study provides further insight into the mechanisms of MD progression while revealing a complex landscape of epigenetic regulatory mechanisms that varies depending on host factors.,"[""Marek's disease (MD) is a neoplastic disease in chickens caused by the MD virus (MDV). Successful vaccine development against MD has resulted in increased virulence of MDV and the understanding of genetic resistance to the disease is, therefore, crucial to long-term control strategies. Also, epigenetic factors are believed to be one of the major determinants of disease response. Here, we carried out comprehensive analyses of the epigenetic landscape induced by MDV, utilizing genome-wide histone H3 lysine 4 and lysine 27 trimethylation maps from chicken lines with varying resistance to MD. Differential chromatin marks were observed on genes previously implicated in the disease such as MX1 and CTLA-4 and also on genes reported in other cancers including IGF2BP1 and GAL. We detected bivalent domains on immune-related transcriptional regulators BCL6, CITED2 and EGR1, which underwent dynamic changes in both lines as a result of MDV infection. In addition, putative roles for GAL in the mechanism of MD progression were revealed.""]"
Does glycation of low-density lipoproteins by methylglyoxal and glycolaldehyde give rise to the in vitro formation of lipid-laden cells?,response,"These results are consistent with LDL glycation, in the absence of oxidation, being sufficient for rapid lipid accumulation by macrophage cells. Aldehyde-mediated ""carbonyl-stress"" may therefore facilitate the formation of lipid-laden (foam) cells in the artery wall.","['Previous studies have implicated the glycoxidative modification of low-density lipoprotein (LDL) by glucose and aldehydes (apparently comprising both glycation and oxidation), as a causative factor in the elevated levels of atherosclerosis observed in diabetic patients. Such LDL modification can result in unregulated cellular accumulation of lipids. In previous studies we have characterized the formation of glycated, but nonoxidized, LDL by glucose and aldehydes; in this study we examine whether glycation of LDL, in the absence of oxidation, gives rise to lipid accumulation in arterial wall cell types. Glycated LDLs were incubated with macrophage, smooth muscle, or endothelial cells. Lipid loading was assessed by HPLC analysis of cholesterol and individual esters. Oxidation was assessed by cholesterol ester loss and 7-ketocholesterol formation. Cell viability was assessed by lactate dehydrogenase release and cell protein levels. Glycation of LDL by glycolaldehyde and methylglyoxal, but not glucose (in either the presence or absence of copper ions), resulted in cholesterol and cholesterol ester accumulation in macrophage cells, but not smooth muscle or endothelial cells. The extent of lipid accumulation depends on the degree of glycation, with increasing aldehyde concentration or incubation time, giving rise to greater extents of particle modification and lipid accumulation. Modification of lysine residues appears to be a key determinant of cellular uptake.']"
